RZ,1978.07.09L,Male,Providence,RI,USA,2912,"Providence, RI 2912, USA","Providence, RI, United States",41.82387161,-71.4119873,7,1978,Letters,Word Of A Better Sort,9,121,"Rene Pittet's algorithm presented in ""Programming Quickies""",4.0,1978.0,148,,"No, they did not",0,1,1,0,0,0,1,0,0,0,1,0,0,0,0,1,0,0,0,1,0,1,1,0,0,0,0,1,0,
RZ,1978.07.10L,Male,Pensacola,FL,USA,32503,"Pensacola, FL 32503, USA","Pensacola, FL, United States",30.42083931,-87.21723175,7,1978,Letters,Why Not Just Use The Phone?,10,121,"Praised Article: Mike Wilber's ""CIE Net: Part 1, The Beginnings"" (page 14). Criticized Article: Jeff Steinwedel's ""Personal Computers In A Communications Network""",2.0,1978.0,80,,"No, they did not",0,1,1,0,1,0,1,0,0,0,1,0,0,0,0,0,0,0,0,1,0,0,0,0,0,0,0,0,1,
RZ,1978.08.01L,Male,Ithaca,NY,USA,14850,"Ithaca, NY 14850, USA","Ithaca, NY, United States",42.4405098,-76.49546051,8,1978,Letters,Hidden Gold In The TI-59?,1,10,,,,,1978.03.??,"No, they did not",0,0,0,0,0,0,1,0,0,0,0,0,0,0,0,0,0,0,0,0,0,0,1,0,0,0,0,1,0,Calculators
RZ,1978.08.02L,Male,Philadelphia,PA,USA,19144,"Philadelphia, PA 19144, USA","Philadelphia, PA, United States",39.95222092,-75.16217804,8,1978,Letters,Text Editing,2,10,"""Essay on the need for sophisticated text editing""",3.0,1978.0,6,,"No, they did not",0,0,0,0,0,0,1,0,0,0,0,0,0,0,0,0,0,0,0,0,0,0,0,0,1,0,0,0,0,Text Editing
RZ,1978.08.03L,Male,Gothenburg,Bohusln,Sweden,415 11,"Gothenburg, Bohusln 415 11, Sweden","Gothenburg, Vastra Gotaland County, Sweden",57.70066833,11.96821976,8,1978,Letters,A Point Of Interest,3,10,,,,,,"Yes, the editors responded",0,0,0,0,0,0,1,0,0,0,0,0,0,0,0,0,0,0,0,0,0,0,0,0,0,0,0,0,0,
RZ,1978.08.04L,Unknown,Canberra City,Australian Capital Territory,Australia,ACT 2601,"Canberra City, Australian Capital Territory ACT 2601, Australia","ACT, Australia",-35.48876572,149.00292969999998,8,1978,Letters,DMA And Video: Articles Needed,4,10,,,,,,"No, they did not",0,0,0,0,0,0,0,0,0,0,0,0,0,0,0,0,0,0,0,0,0,0,0,0,1,0,0,0,0,"Memory, Video"
RZ,1978.08.05L,Male,Holmdel,NJ,USA,7733,"Holmdel, NJ 7733, USA","Holmdel Township, NJ, United States",40.38454056,-74.18808746,8,1978,Letters,A More Inexpensive Direct Video Conversion?,5,10,"""Article by Dan Fylstra about converting a TV set into a monitor.""",5.0,1978.0,22,,"Yes, the editors responded",0,0,0,0,0,0,1,0,0,0,0,0,0,0,0,0,0,0,0,0,0,0,0,0,0,0,0,1,0,Monitors
RZ,1978.08.06L,Male,Columbus,OH,USA,43213,"Columbus, OH 43213, USA","Columbus, OH, United States",39.96199036,-83.00274658,8,1978,Letters,TRS-80 Interfaces Wanted,6,120,,,,,,"No, they did not",0,0,0,0,0,0,0,0,0,0,0,0,0,0,0,0,0,0,0,0,0,0,0,0,1,0,0,0,0,Calculators
RZ,1978.08.07L,Female,Coloma,MI,USA,49038,"Coloma, MI 49038, USA","Coloma, MI, United States",42.18643951,-86.30628967,8,1978,Letters,A Software Exchange?,7,120,,,,,,"No, they did not",0,1,0,0,0,0,1,1,0,0,0,0,0,0,0,0,0,0,0,0,0,0,1,0,1,0,1,0,0,
RZ,1978.08.08L,Male,Rapid City,SD,USA,57709,"Rapid City, SD 57709, USA","Rapid City, SD, United States",44.0811615,-103.23088840000001,8,1978,Letters,Pet Bug?,8,121,,,,,,"No, they did not",0,0,1,0,0,0,1,0,0,0,0,0,0,0,0,1,0,0,0,0,0,1,1,0,0,0,0,1,0,
RZ,1978.09.01L,Male,Ithaca,NY,USA,14850,"Ithaca, NY 14850, USA","Ithaca, NY, United States",42.4405098,-76.49546051,9,1978,Letters,Wanted: A Random Number Circuit,1,17,,,,,,"Yes, the editors responded",0,0,0,0,0,0,1,0,0,0,0,0,0,1,0,0,0,0,0,0,0,0,1,0,1,0,0,1,0,
RZ,1978.09.02L,Male,City of Edinburgh,Edinburgh,Scotland,EH16 4EB,"City of Edinburgh, Edinburgh EH16 4EB, Scotland","Edinburgh, Scotland, United Kingdom",55.95429993,-3.201889992,9,1978,Letters,What a Small Computer can do for the Multiply Handicapped,2,17,,,,,,"No, they did not",0,1,0,0,0,0,1,0,0,0,0,1,0,1,1,0,0,0,0,0,0,0,0,0,0,0,0,0,1,
RZ,1978.09.03L,Unknown,Tokyo,The Greater Tokyo Area,Japan,100-91,"Tokyo, The Greater Tokyo Area 100-91, Japan",Japan,36.65333557,137.98168950000002,9,1978,Letters,Some Notes from Japan,3,17,,,,,,"No, they did not",0,0,1,0,0,0,1,0,1,0,0,0,0,0,0,0,0,0,0,0,1,1,1,0,0,0,0,1,0,Calculators
RZ,1978.09.04L,Male,Dallas,TX,USA,75243,"Dallas, TX 75243, USA","Dallas, TX, United States",32.77814865,-96.79540253,9,1978,Letters,Rare Chassis?,4,66,Convert Your TV Set to a Video Monitor,5.0,1978.0,22,,"No, they did not",0,0,0,0,0,0,1,0,0,0,0,0,0,0,0,0,0,0,0,1,0,1,0,0,0,0,0,0,0,TV
RZ,1978.09.05L,Male,Sunnyvale,CA,USA,94806,"Sunnyvale, CA 94806, USA","Sunnyvale, CA, United States",37.37171936,-122.038002,9,1978,Letters,Needed: Satellite Receiver with Imaging Capability,5,66,,,,,,"Yes, the editors responded",0,0,0,0,0,0,0,0,0,0,0,0,0,0,0,0,0,0,0,0,0,0,0,0,1,1,0,0,0,Satellite reception
RZ,1978.09.06L,Male,San Dimas,CA,USA,91773,"San Dimas, CA 91773, USA","San Dimas, CA, United States",34.10668182,-117.8029785,9,1978,Letters,Dreaming...,6,66,,,,,,"Yes, the editors responded",0,0,0,0,0,0,1,0,0,0,0,0,0,0,0,0,1,0,0,0,0,0,0,0,0,0,0,0,0,
RZ,1978.09.07L,Unknown,Calgary,Alberta,Canada,T2N 0Z9,"Calgary, Alberta T2N 0Z9, Canada","Calgary, AB, Canada",51.0453186,-114.06301119999999,9,1978,Letters,Gotcha!,7,67,"""On page 154 of the May 1978 BYTE you described the new products by Lucas-Adams Labs Unitd.""",5.0,1978.0,154,,"Yes, the editors responded",0,0,0,0,0,0,0,0,1,0,0,0,0,0,0,0,0,0,0,0,0,0,0,0,1,1,0,0,0,
RZ,1978.09.08L,Male,San Antonio,TX,USA,78233,"San Antonio, TX 78233, USA","San Antonio, TX, United States",29.42457962,-98.49461365,9,1978,Letters,Kudos for Kent,8,67,The Brains of Men and Machines,1.0,1978.0,,,"No, they did not",0,1,0,0,1,0,1,0,0,0,0,0,0,0,0,0,0,0,0,1,0,0,1,0,0,0,0,0,1,
RZ,1978.10.01L,Male,Columbus,IN,USA,47201,"Columbus, IN 47201, USA","Columbus, IN, United States",39.20149994,-85.91867828,10,1978,Letters,Top-Down Modular Programming,1,10,"""Top-Down Modular Programming"" by Albert D Hearn",7.0,1978.0,32,,"No, they did not",0,0,0,0,0,0,1,0,0,0,1,0,0,0,0,0,0,0,0,1,0,0,1,0,0,0,0,1,1,
RZ,1978.10.02L,Male,Sarasota,FL,USA,33580,"Sarasota, FL 33580, USA","Sarasota, FL, United States",27.33888054,-82.53962708,10,1978,Letters,"A Tall Order, but in Principle Doable...",2,156,,,,,,"Yes, the editors responded",0,1,0,0,0,0,1,0,0,0,0,0,0,0,0,0,0,0,0,0,0,0,1,0,1,0,0,0,1,Television
RZ,1978.10.03L,Male,Monroe,CT,USA,6468,"Monroe, CT 6468, USA","Monroe, CT, United States",41.33506012,-73.20581055,10,1978,Letters,Timely Comments on Kim,3,156,Kimer: A Kim-1 Timer by Robert Baker,7.0,1978.0,12,,"No, they did not",0,0,1,0,0,0,1,0,0,1,0,0,0,0,0,0,0,0,0,0,0,0,1,0,0,0,0,1,0,Timers/Clocks
RZ,1978.10.04L,Male,Nashville,TN,USA,37204,"Nashville, TN 37204, USA","Nashville, TN, United States",36.16783905,-86.7781601,10,1978,Letters,A SwTPC 6800 Fix,4,156,,,,,,"No, they did not",0,0,1,0,0,0,0,0,0,0,0,0,0,0,0,0,0,0,0,0,0,0,1,0,0,0,0,1,0,
RZ,1978.10.05L,Male,Sunnyvale,CA,USA,94087,"Sunnyvale, CA 94087, USA","Sunnyvale, CA, United States",37.37171936,-122.038002,10,1978,Letters,Personal Computer Communications Network,5,157,Personal Computers in a Communications Network,2.0,1978.0,80,,"No, they did not",0,1,1,0,1,0,1,0,0,0,0,0,0,0,0,0,0,0,0,0,0,0,0,0,0,0,1,0,0,
RZ,1978.10.06L,Male,Sun Valley,CA,USA,91352,"Sun Valley, CA 91352, USA","CA, United States",34.21546936,-118.37033840000001,10,1978,Letters,"Personal Computers Require Insurance, too...",6,157,,,,,,"Yes, the editors responded",0,0,0,0,0,0,1,0,0,0,0,0,0,0,0,0,0,0,0,0,0,0,0,0,1,0,0,0,0,Computer Insurance
RZ,1978.10.07L,Male,Grinnell,IA,USA,50112,"Grinnell, IA 50112, USA","Grinnell, IA, United States",41.74687958,-92.72737122,10,1978,Letters,Regional Basic Contest Notes,7,158,Regional Basic Contest,7.0,1978.0,,,"No, they did not",0,1,1,0,0,1,1,0,0,1,0,0,0,0,0,0,0,0,0,1,0,0,1,0,0,0,0,0,0,
RZ,1978.10.08L,Male,6107 Reinhelm/Odenwald 1,Hesse,West Germany,,"6107 Reinhelm/Odenwald 1, Hesse, West Germany","HE, Germany",50.60318375,9.030748367000001,10,1978,Letters,Some Aces Need Engineering,8,158,,,,,,"No, they did not",0,1,1,0,0,0,1,0,0,0,0,0,0,0,0,0,0,0,0,1,0,0,0,0,1,1,0,0,1,
RZ,1978.10.09L,Male,Petersham,NSW,Australia,2049,"Petersham, NSW 2049, Australia","Sydney, NSW, Australia",-33.89630127,151.1538849,10,1978,Letters,9900 Down Under,9,158,,,,,,"No, they did not",0,0,0,0,0,0,1,0,0,0,0,0,0,0,0,0,0,0,0,1,0,0,0,0,1,0,0,0,0,
RZ,1978.10.10L,Male,Vancouver,British Columbia,Canada,V65 1B2,"Vancouver, British Columbia V65 1B2, Canada","Vancouver, BC, Canada",49.26037979,-123.11335749999999,10,1978,Letters,A Few Notes from a Canadian Reader,10,160,,,,,,"No, they did not",0,0,1,0,0,0,1,0,0,0,0,0,0,0,0,0,0,0,0,0,0,0,0,0,0,0,0,1,0,
RZ,1978.10.11L,Male,Roanoke,VA,USA,24015,"Roanoke, VA 24015, USA","Roanoke, VA, United States",37.27151871,-79.94056702,10,1978,Letters,Erom Confusion: The 2716,11,160,,,,,1978.07.11,"No, they did not",0,0,1,0,0,0,1,0,1,0,0,0,0,0,0,0,0,0,0,0,0,1,0,0,0,0,0,1,0,
RZ,1978.10.12L,Male,Marsta,Sigtuna Municipality,Sweden,S-195 00,"Marsta, Sigtuna Municipality S-195 00, Sweden","Mrsta, Stockholm County, Sweden",59.61977005,17.85457039,10,1978,Letters,In Search of Speed,12,160,,,,,,"No, they did not",0,0,1,0,0,0,1,0,0,0,0,0,0,0,0,0,0,0,0,0,0,1,0,0,0,0,0,0,0,
RZ,1978.11.01L,Male,Mission Hills,CA,USA,91345,"Mission Hills, CA 91345, USA","Mission Hills, CA, United States",34.68610001,-120.4363937,11,1978,Letters,Schematic Encounter,1,10,,,,,,"No, they did not",0,0,1,0,0,0,1,0,0,0,0,0,0,0,1,0,0,0,0,0,0,0,0,0,1,0,0,0,1,
RZ,1978.11.02L,Male,Minneapolis ,MN,USA,55407,"Minneapolis, MN 55407, USA","Minneapolis, MN, United States",44.97901917,-93.26493835,11,1978,Letters,Interpreter Information Wanted,2,10,,,,,,"Yes, the editors responded",0,1,1,0,0,0,1,0,0,0,0,0,0,0,0,0,0,0,0,0,0,0,1,0,1,1,0,0,0,
RZ,1978.11.03L,Male,Holland,MI,USA,49423,"Holland, MI 49423, USA","Holland, MI, United States",42.83187103,-86.07852173,11,1978,Letters,Praise for Bits,3,141,,,,,,"Yes, the editors responded",0,0,0,0,0,0,1,0,0,0,0,0,1,0,0,0,0,0,0,1,0,0,0,0,0,0,0,0,0,
RZ,1978.11.04L,Male,Mountain View,CA,USA,94040,"Mountain View, CA 94040, USA","Mountain View, CA, United States",37.38967133,-122.08159640000001,11,1978,Letters,Manuscript Editing Paradise,4,141,Editorial: Don't Ignore the High End...or My Search for Manuscript Editing Paradise,3.0,1978.0,6,,"No, they did not",0,0,1,0,0,0,1,0,0,1,0,0,0,0,0,0,0,0,0,0,0,1,0,0,0,0,0,1,0,"Graphics, Editing"
RZ,1978.11.05L,Male,Storrs,CT,USA,6268,"Storrs, CT 6268, USA","Storrs, CT, United States",41.80855179,-72.24993134,11,1978,Letters,Too many Experts?,5,141,Pascal versus Basic: An Exercise,11.0,1978.0,168,,"Yes, the editors responded",0,0,0,0,0,0,1,0,0,0,0,0,0,0,0,0,0,0,0,0,0,0,1,0,0,0,0,0,1,
RZ,1978.11.06L,Male,Chicago,IL,USA,60626,"Chicago, IL 60626, USA","Chicago, IL, United States",41.88425064,-87.63244629,11,1978,Letters,Reader Cs Pascal Alternative,6,142,Compilation and Pascal on the New Microprocessors,8.0,1978.0,50,,"No, they did not",0,0,1,0,0,0,1,0,0,0,0,0,0,0,0,0,0,1,0,1,0,1,1,0,0,1,0,0,1,
RZ,1978.11.07L,Male,Hanover,NH,USA,3755,"Hanover, NH 3755, USA","Hanover, NH, United States",43.70246887,-72.2885437,11,1978,Letters,Stored Programs: A Reply,7,142,Short History of Computing,7.0,1978.0,84,,"Yes, the editors responded",0,0,0,0,0,0,1,0,1,1,0,0,0,0,0,0,0,0,0,0,0,0,1,0,0,0,0,0,0,
RZ,1978.11.08L,Unknown,Sunnyvale,CA,USA,94086,"Sunnyvale, CA 94086, USA","Sunnyvale, CA, United States",37.37171936,-122.038002,11,1978,Letters,The 2650 Becomes More Available,8,143,How to Choose a Microprocessor,7.0,1978.0,124,,"No, they did not",0,0,1,0,0,0,1,0,1,0,0,0,0,0,0,0,0,0,0,1,0,0,0,0,0,0,1,0,1,
RZ,1978.11.09L,Male,Newark,DE,USA,19711,"Newark, DE 19711, USA","Newark, DE, United States",39.67800903,-75.7618103,11,1978,Letters,Rounding Out Some Calculations,9,143,"Antique Mechanical Computers, Part 2 (and: ""Philadelphia's 179 Year Old Android"", ""Pascal versus COBOL"",",8.0,1978.0,96,,"No, they did not",0,1,0,0,0,0,1,0,0,1,0,0,0,0,0,0,0,0,0,1,0,0,1,0,0,0,0,0,1,Computer Storage
RZ,1978.11.10L,Unknown,Amsterdam,North Holland,The Netherlands,,"Amsterdam, North Holland, The Netherlands","Amsterdam, North Holland, Netherlands",52.33480072,4.870530128,11,1978,Letters,On Buses and Languages,10,144,,,,,,"Yes, the editors responded",0,1,1,0,1,0,1,1,0,0,0,0,0,0,0,0,0,0,0,0,0,0,1,0,1,0,0,0,1,
RZ,1978.11.11L,Unknown,Berwyn,IL,USA,60402,"Berwyn, IL 60402, USA","Berwyn, IL, United States",41.84328842,-87.79126740000001,11,1978,Letters,More Pixels Per Pixe?,11,144,Convert Your TV Set to a Video Monitor,5.0,1978.0,22,,"No, they did not",0,0,0,0,0,0,1,0,0,1,0,0,0,0,0,0,0,0,0,0,0,0,0,0,0,0,0,1,0,Television
RZ,1978.11.12L,Male,Bethesda,MD,USA,20034,"Bethesda, MD 20034, USA","Bethesda, MD, United States",38.98637009,-77.0969162,11,1978,Letters,Abacus Query,12,145,A Short History of Computing,7.0,1978.0,84,,"No, they did not",0,0,1,0,0,0,1,0,0,1,0,0,0,0,0,0,0,0,0,0,0,0,1,0,1,0,0,0,0,
RZ,1978.11.13L,Male,FPO,New York,USA,9501,"FPO, New York 9501, USA","NY, United States",42.93708038,-75.61069489,11,1978,Letters,On Other Hardware Ways to Multiply,13,145,How to Multiply in a Wet Climate: Design Details,5.0,1978.0,104,,"Yes, the editors responded",0,0,0,0,0,0,1,0,0,0,0,0,0,0,0,0,0,0,0,1,0,0,1,0,0,1,0,0,0,
KD,1978.12.01L,Male,Rochester,NY,USA,14618,"Rochester, NY 14618, USA","Rochester, NY, United States",43.15579987,-77.61631775,12,1978,Letters,Pascal Praise,1,10,Pascal programming,8.0,1978.0,,,"No, they did not",0,0,0,0,0,0,0,0,0,0,0,0,0,0,0,0,0,0,0,1,0,0,1,0,0,0,0,0,0,
KD,1978.12.02L,Male,Torrance,CA,USA,90505,"Torrance, CA 90505, USA","Torrance, CA, United States",33.83705139,-118.3431168,12,1978,Letters,Automaton Trumpeter Lives,2,10,Antique Mechanical Computers Part 2,12.0,1978.0,10,,"No, they did not",0,0,0,0,0,0,0,0,0,0,0,0,0,0,0,0,0,0,0,0,0,1,0,0,0,0,0,0,0,History
KD,1978.12.03L,Male,Honolulu,HI,USA,96822,"Honolulu, HI 96822, USA","Honolulu, HI, United States",21.30492973,-157.8578796,12,1978,Letters,Computers and Advertising,3,10,,,,,,"No, they did not",0,0,0,0,0,0,0,0,0,0,0,0,0,0,0,0,0,0,0,0,0,0,0,0,1,0,0,0,1,
KD,1978.12.04L,Male,Fort Sask,Alberta,Canada,T8L 2N8,"Fort Sask, Alberta T8L 2N8, Canada","Fort Saskatchewan, AB, Canada",53.71287918,-113.21417240000001,12,1978,Letters,Signetics 2650: A Correction,4,10,How to Choose a Microprocessor,7.0,1978.0,,,"No, they did not",0,0,0,0,0,0,1,0,0,1,0,0,0,0,0,0,0,0,0,1,0,1,1,0,0,0,0,1,0,
KD,1978.12.05L,Female,Pilot Mountain,NC,USA,27041,"Pilot Mountain, NC 27041, USA","Pilot Mountain, NC, United States",36.3904686,-80.47351837,12,1978,Letters,Some References on Networking and Protocols,5,10,Editorial,7.0,1978.0,,,"No, they did not",0,1,1,0,1,0,0,0,0,0,0,0,0,0,0,0,0,0,0,0,0,0,0,0,0,0,0,0,0,
KD,1978.12.06A,Male,Columbus,IN,USA,47201,"Columbus, IN 47201, USA","Columbus, IN, United States",39.20149994,-85.91867828,12,1978,Ask Byte,Sizing Up Modular Programming,6,158,Top-Down Modular Programming,7.0,1978.0,,,"No, they did not",0,0,0,0,0,0,1,0,0,0,0,0,0,0,0,0,0,0,0,0,0,0,1,0,0,0,0,1,1,
RZ,1978.12.07L,Male,Yuba City,CA,USA,95991,"Yuba City, CA 95991, USA","Yuba City, CA, United States",39.1407814,-121.61946110000001,12,1978,Letters,Light Seeking Robot,7,158,On Building a Light-Seeking Robot Mechanism,8.0,1978.0,24,,"No, they did not",1,0,0,0,0,0,1,0,0,0,0,0,0,0,0,0,0,0,0,1,0,0,1,0,0,0,0,1,0,
RZ,1978.12.08L,Male,White Bear Lake,MN,USA,55110,"White Bear Lake, MN 55110, USA","White Bear Lake, MN, United States",45.08280182,-93.0121994,12,1978,Letters,Ciarcia's Circuit Cellar,8,158,Let Your Fingers Do the Talking,8.0,1978.0,156,,"No, they did not",0,0,0,0,0,0,1,1,0,0,0,0,0,0,0,0,0,0,0,1,0,0,0,0,0,0,0,0,1,
RZ,1978.12.09L,Unknown,Stamford,CT,USA,6905,"Stamford, CT 6905, USA","Stamford, CT, United States",41.05181885,-73.5422287,12,1978,Letters,A Question of Patents,9,158,Let Your Fingers Do the Talking,8.0,1978.0,156,,"Yes, the editors responded",0,0,1,0,0,0,0,0,1,0,0,0,0,0,0,0,0,1,0,0,0,0,0,0,0,1,0,0,1,Patents
RZ,1978.12.10L,Male,Baltimore,MD,USA,21201,"Baltimore, MD 21201, USA","Baltimore, MD, United States",39.29058075,-76.60926056,12,1978,Letters,Plato and the Touch Panel,10,159,,,,,,"Yes, the editors responded",0,1,0,0,0,0,1,0,1,0,0,0,0,0,0,0,0,0,0,1,0,0,0,0,0,0,0,0,1,Touch Panels
RZ,1978.12.11L,Unknown,Winnipeg,Manitoba,Canada,R3C 2P7,"Winnipeg, Manitoba R3C 2P7, Canada","Winnipeg, MB, Canada",49.899528499999995,-97.14112854,12,1978,Letters,Voicing An Opinion,11,159,Give an Ear to Your Computer,6.0,1978.0,56,,"No, they did not",0,1,0,0,0,0,1,0,0,0,0,0,0,0,0,0,0,0,0,1,0,0,1,0,0,0,0,0,0,Voice Recognition
RZ,1978.12.12L,Male,Mercer Island,WA,USA,98040,"Mercer Island, WA 98040, USA","Mercer Island, WA, United States",47.57812881,-122.21127320000001,12,1978,Letters,Calling All Computers,12,159,,,,,,"No, they did not",0,1,1,0,1,0,1,0,0,0,0,0,0,0,0,0,0,0,0,0,0,0,0,0,1,0,0,0,0,
RZ,1978.12.13L,Male,Birmingham,AL,USA,35294,"Birmingham, AL 35294, USA","Birmingham, AL, United States",33.52067947,-86.81175995,12,1978,Letters,Ideas Needed for Project to Aid Disabled,13,160,,,,,,"No, they did not",0,1,0,0,1,0,1,0,0,0,0,1,0,0,0,0,0,0,0,0,1,0,1,0,1,0,0,0,0,"Speech Recognition, Monitors"
RZ,1979.01.01L,Male,Whittier,CA,USA,90601,"Whittier, CA 90601, USA","Whittier, CA, United States",33.97542191,-118.0340729,1,1979,Letters,Computer Insurance?,1,10,,,,,1978.10.??,"No, they did not",0,0,0,0,0,0,1,0,1,0,0,0,0,0,0,0,0,1,0,0,0,0,0,0,0,0,1,0,1,Insurance
RZ,1979.01.02L,Unknown,Tokyo,The Greater Tokyo Area,Japan,100-91,"Tokyo, The Greater Tokyo Area 100-91, Japan",Japan,36.65333557,137.98168950000002,1,1979,Letters,Some Footnotes From Japan,2,10,,,,,1978.09.??,"No, they did not",0,0,1,0,0,0,1,0,1,0,0,0,0,0,0,0,0,0,0,0,0,0,1,0,0,0,1,0,0,
RZ,1979.01.03L,Unknown,Montreal,Quebec,Canada,HSE 1Z3,"Montreal, Quebec HSE 1Z3, Canada","Montreal, QC, Canada",45.51240158,-73.5546875,1,1979,Letters,Jumping Backwards with Waduzitdo,3,166,,,,,,"No, they did not",0,1,0,0,0,0,1,0,0,0,0,0,0,1,0,1,0,0,0,0,0,0,1,0,0,0,0,1,0,
RZ,1979.01.04L,Male,Cleveland,OH,USA,44115,"Cleveland, OH 44115, USA","Cleveland, OH, United States",41.50473022,-81.69074249,1,1979,Letters,A Timely Modification to Kimer,4,166,Kimer: A KIM-1 Timer,7.0,1978.0,12,,"No, they did not",0,0,0,0,0,0,1,0,0,1,0,0,0,0,0,1,0,0,0,0,0,0,1,0,0,0,0,1,0,Timers
RZ,1979.01.05L,Male,Annapolis,MD,USA,21402,"Annapolis, MD 21402, USA","Annapolis, MD, United States",38.97677994,-76.49014282,1,1979,Letters,Graphic Presentation,5,168,"The Mathematics of Computer Graphics by Jeffrey L Posdamer, Graphics Manipulations Using Matrices by Joel C Hungerford",9.0,1978.0,"22, 156",,"No, they did not",0,1,0,0,0,0,1,0,0,0,0,0,0,0,0,0,0,0,0,1,0,0,0,0,0,0,0,0,0,"Computer Graphics, Books/Publications"
RZ,1979.01.06L,Male,Addison,IL,USA,60101,"Addison, IL 60101, USA","Addison, IL, United States",41.93407059,-87.99349976,1,1979,Letters,Tiny Pascal,6,168,A 'Tiny' Pascal Compiler (article series 09-11),9.0,1978.0,,,"No, they did not",0,0,0,0,0,0,1,1,0,0,0,0,0,0,0,0,0,0,0,1,0,0,1,0,0,1,0,0,0,
RZ,1979.01.07L,Male,New York,NY,USA,10033,"New York, NY 10033, USA","New York, NY, United States",40.71455002,-74.00714111,1,1979,Letters,Chess 4.6 Defeated?,7,168,A Computer Chess Tutorial,10.0,1978.0,168,,"No, they did not",0,0,1,0,0,0,1,0,0,0,0,0,0,1,0,0,0,0,0,0,0,0,1,0,0,0,1,0,0,
RZ,1979.01.08L,Male,Bradenton,FL,USA,33505,"Bradenton, FL 33505, USA","Bradenton, FL, United States",27.49550056,-82.57807159,1,1979,Letters,Heath Bit,8,168,Related ASCII code remedy,9.0,1978.0,147,,"No, they did not",0,0,1,0,0,0,1,0,0,1,0,0,0,0,0,0,0,0,0,0,0,0,1,0,0,0,0,1,0,
RZ,1979.01.09L,Unknown,Stillwater,MN,USA,55082,"Stillwater, MN 55082, USA","Stillwater, MN, United States",45.05670166,-92.81056976,1,1979,Letters,Clarifying The Limit,9,169,The Sky's the Limit,11.0,1978.0,48,,"Yes, the editors responded",0,0,0,0,1,0,1,0,0,1,0,0,0,0,0,0,0,0,0,0,0,0,0,0,0,0,0,0,1,FCC Regulations
RZ,1979.01.10L,Male,Chicago,IL,USA,60609,"Chicago, IL 60609, USA","Chicago, IL, United States",41.88425064,-87.63244629,1,1979,Letters,House Operating System,10,169,Editorial on the distribution of interests through a BYTE survey,10.0,1978.0,,,"No, they did not",0,0,1,0,0,0,1,0,1,0,0,0,0,0,0,0,0,0,0,1,0,1,1,0,0,0,0,0,1,Power Control System
RZ,1979.02.01L,Male,Pasadena,CA,USA,91105,"Pasadena, CA 91105, USA","Pasadena, CA, United States",34.14744949,-118.1442719,2,1979,Letters,Abacus Answers,1,10,,,,,1978.11.??,"No, they did not",0,0,1,0,0,0,1,0,0,0,0,0,0,0,0,0,0,0,0,0,0,1,0,0,0,0,0,0,0,"Abacus, Calculators, Counting Boards"
RZ,1979.02.02L,Male,San Marcos,TX,USA,78666,"San Marcos, TX 78666, USA","San Marcos, TX, United States",29.88607979,-97.92817688,2,1979,Letters,More on the Abacus,2,10,A Short History of Computing,7.0,1978.0,84,1978.11.??,"No, they did not",0,0,1,0,0,0,1,0,0,0,0,0,0,0,0,0,0,0,0,0,0,1,0,0,0,0,0,0,0,"Abacus, Calculators, Counting Boards"
RZ,1979.02.03L,Unknown,Kuala Lumpur,Selangor,Malaysia,08-06 W,"Kuala Lumpur, Selangor 08-06 W, Malaysia","Kuala Lumpur, Federal Territory of Kuala Lumpur, Malaysia",3.1478900910000003,101.69405359999999,2,1979,Letters,Ratfor Rational,3,152,Pascal,8.0,1978.0,,,"No, they did not",0,1,1,0,0,0,1,1,0,1,0,0,0,0,0,0,0,0,0,0,0,1,1,0,0,0,1,1,1,
RZ,1979.02.04L,Male,Houston,TX,USA,77092,"Houston, TX 77092, USA","Houston, TX, United States",29.76058006,-95.36968231,2,1979,Letters,Use of Descriptive Variables,4,152,"Creating a Chess Player, Part 2: Chess 0.5",11.0,1978.0,162,,"No, they did not",0,1,1,0,0,0,1,0,0,1,0,0,0,1,0,1,0,0,0,0,0,0,1,0,0,0,0,1,0,
RZ,1979.03.01L,Male,Atlanta,GA,USA,30309,"Atlanta, GA 30309, USA","Atlanta, GA, United States",33.74831009,-84.39111328,3,1979,Letters,Of Kitchens and Computers,1,10,"Proposal for a Kitchen Inventory System, or Don't Byte the Wand that Feeds You",12.0,1978.0,184,,"Yes, the editors responded",0,1,0,0,0,0,1,0,1,1,0,0,0,0,0,0,0,0,0,0,0,0,0,0,0,1,1,0,1,
RZ,1979.03.02L,Female,Chicago,IL,USA,60646,"Chicago, IL 60646, USA","Chicago, IL, United States",41.88425064,-87.63244629,3,1979,Letters,Computer Humor,2,10,,,,,,"No, they did not",0,0,0,0,0,0,1,0,0,0,0,0,0,0,0,0,0,0,0,0,0,0,0,0,0,0,0,0,0,Poems
RZ,1979.03.03L,Male,Charlottesville,VA,USA,22903,"Charlottesville, VA 22903, USA","Charlottesville, VA, United States",38.0321312,-78.47756195,3,1979,Letters,Concerning Chess and Pascal,3,10,Creating a Chess Player,10.0,1978.0,182,,"No, they did not",0,1,0,0,0,0,1,0,0,1,0,0,0,1,0,0,0,0,0,1,0,0,1,0,0,0,0,1,1,
RZ,1979.03.04L,Male,Ashton,IA,USA,51232,"Ashton, IA 51232, USA","Ashton, IA, United States",43.31595993,-95.78701782,3,1979,Letters,Attention Atari Experts,4,226,,,,,,"No, they did not",0,0,1,0,0,0,1,0,0,0,0,0,0,1,1,0,0,0,0,0,0,0,1,0,1,0,0,0,0,
RZ,1979.03.05L,Male,Stamford ,CT,USA,6902,"Stamford, CT 6902, USA","Stamford, CT, United States",41.05181885,-73.5422287,3,1979,Letters,Digicast: A Correction And An Opinion,5,226,The Digicast System,1.0,1979.0,100,,"No, they did not",0,0,1,0,1,0,1,0,0,1,0,0,0,0,0,0,0,0,0,0,0,0,0,0,0,0,0,0,0,Television
RZ,1979.03.06L,Male,Melbourne,Victoria,USA,3004,"Melbourne, Victoria 3004, USA","Melbourne, VIC, Australia",-37.81753159,144.96714780000002,3,1979,Letters,Can Our Readers Help?,6,226,,,,,,"Yes, the editors responded",0,0,1,0,0,0,0,0,1,0,0,0,0,0,0,0,0,0,0,0,0,0,0,0,1,1,0,0,0,
RZ,1979.03.07L,Male,Corvallis,OR,USA,97330,"Corvallis, OR 97330, USA","Corvallis, OR, United States",44.56502914,-123.26351170000001,3,1979,Letters,Text Editor,7,226,"Editorial: ""On the Virtues of Writing Editors""",11.0,1978.0,6,,"No, they did not",0,0,1,0,1,0,1,0,0,0,0,0,0,0,0,1,0,0,0,0,0,1,1,0,1,0,1,0,1,
RZ,1979.04.01L,Male,Upland,CA,USA,91786,"Upland, CA 91786, USA","Upland, CA, United States",34.09939957,-117.65100859999998,4,1979,Letters,Successful Transformation,1,8,"""Fast Fourier Transforms on Your Home Computer,"" by William D Stanley and Steven J Peterson",12.0,1978.0,14,,"Yes, the editors responded",0,0,0,0,0,0,1,0,0,0,0,0,0,1,0,0,0,0,0,1,0,1,1,0,0,1,0,0,0,"""Home Computer"""
RZ,1979.04.02L,Male,Mansfield,OH,USA,44903,"Mansfield, OH 44903, USA","Mansfield, OH, United States",40.75854111,-82.51524353,4,1979,Letters,Making Cents,2,8,,,,,,"No, they did not",0,0,1,0,0,0,0,0,0,0,0,0,0,0,0,1,0,1,0,1,0,1,1,0,0,0,0,1,1,
RZ,1979.04.03L,Female,St Louis,MO,USA,63117,"St Louis, MO 63117, USA","St Louis, MO, United States",38.6277504,-90.19956207,4,1979,Letters,Digicast Data,3,8,"The Digicast System: Receiving Data and Information over your FM Radio"" by Mr Halsema",1.0,1979.0,100,,"No, they did not",0,1,1,0,1,0,1,0,0,0,0,0,0,0,0,0,0,0,0,0,0,1,0,0,0,0,0,0,1,Federal Regulation
RZ,1979.04.04L,Male,Latrobe,PA,USA,15650,"Latrobe, PA 15650, USA","Latrobe, PA, United States",40.31663895,-79.38494109999999,4,1979,Letters,1802 Quest for Information,4,206,,,,,,"Yes, the editors responded",0,0,1,0,0,1,1,0,0,0,0,0,0,0,0,0,0,0,0,1,0,1,1,0,0,1,1,0,1,Hardware
RZ,1979.04.05L,Male,District Heights,MD,USA,20028,"District Heights, MD 20028, USA","District Heights, MD, United States",38.862178799999995,-76.88244629,4,1979,Letters,Cancelled and Happy?,5,206,,,,,,"No, they did not",0,0,1,0,0,0,1,1,0,0,0,0,0,0,1,0,0,0,0,1,0,1,0,0,0,0,0,0,1,Subscription
RZ,1979.04.06L,Male,Prince George,VA,USA,23875,"Prince George, VA 23875, USA","Prince George, VA, United States",37.22085953,-77.28672791,4,1979,Letters,A Base Comment,6,206,Harold Pritchard calculator article,1.0,1979.0,165,,"No, they did not",0,0,1,0,0,0,1,0,0,0,0,0,0,0,0,0,0,0,0,1,0,0,0,0,0,0,0,1,0,Calculators
RZ,1979.04.07L,Female,Menlo Park,CA,USA,94025,"Menlo Park, CA 94025, USA","Menlo Park, CA, United States",37.4553299,-122.1785812,4,1979,Letters,Copyright Information Gathering,7,206,,,,,,"Yes, the editors responded",0,1,1,0,0,0,1,0,0,0,0,0,0,0,0,0,0,1,1,0,0,0,0,0,1,1,1,0,1,
RZ,1979.04.08L,Male,Hollywood,CA,USA,90036,"Hollywood, CA 90036, USA","Los Angeles, CA, United States",34.10155869,-118.33708190000002,4,1979,Letters,IBM Emulation Information Needed,8,207,,,,,,"No, they did not",0,0,0,0,1,0,1,0,1,0,0,0,0,0,0,0,0,1,0,0,0,0,0,0,1,1,1,0,0,
